{
  "schema_version": "1.0.0",
  "plan_id": "cug-au-080801-2023",
  "institution": "中国地质大学（武汉）",
  "college_id": "au",
  "college_name": "人工智能与自动化学院",
  "major": "自动化",
  "major_code": "080801",
  "version": "2023版",
  "applicable_cohorts": [
    2023,
    2024,
    2025,
    2026
  ],
  "total_credits": 170,
  "semester_mapping_2026_fall": {
    "target_term": "2026年秋季",
    "nominal_by_entry_cohort": {
      "2026": 1,
      "2025": 3,
      "2024": 5,
      "2023": 7
    },
    "requires_user_confirmation": true,
    "confirmation_fields": [
      "入学年级",
      "实际所在学期",
      "是否休学/转专业/留级/提前修读",
      "专业与班型"
    ],
    "note": "软件只能把入学年级换算为名义学期；实际课程清单必须由用户确认后才能排课。"
  },
  "source": {
    "landing_url": "https://au.cug.edu.cn/info/1016/2305.htm",
    "direct_url": "https://au.cug.edu.cn/zidonghuazhuanyebenkeshengpeiyangfangan-2023ban.pdf",
    "retrieved_at": "2026-08-23",
    "sha256": "fa8d5acdb0e9db5286300b7efbff51ac72cc442421a3e80fe85b0130962c12bc",
    "byte_size": 794903,
    "page_count": 26,
    "course_table_pages": [
      20,
      21,
      22,
      23,
      24,
      25
    ],
    "pdf_metadata_created": "2024-05-16",
    "official_pdf_committed": false
  },
  "verification": {
    "method": "pdfplumber表格抽取 + PyMuPDF 2.5倍渲染 + 逐页人工视觉复核",
    "all_course_table_pages_rendered": true,
    "all_course_rows_visually_checked": true,
    "course_record_count": 79,
    "required_fields_checked": [
      "code",
      "name",
      "credits",
      "recommended_semester",
      "category",
      "required_or_elective",
      "source_page"
    ]
  },
  "credit_requirements": {
    "通识教育课": 43,
    "大类平台课": 35.5,
    "学科基础课": 16.5,
    "专业主干课": 20.5,
    "专业选修课最低修读": 15.5,
    "实践环节": 34,
    "创新创业自主学习": 5
  },
  "courses": [
    {
      "code": "12007800",
      "name": "马克思主义基本原理",
      "credits": 3,
      "recommended_semester": [
        2
      ],
      "semester_credit_distribution": {
        "2": 3
      },
      "semester_allocation_note": null,
      "category": "通识教育课",
      "required_or_elective": "required",
      "selection_group": null,
      "selection_rule": null,
      "source_page": 20,
      "issue_ids": []
    },
    {
      "code": "12008100",
      "name": "毛泽东思想和中国特色社会主义理论体系概论",
      "credits": 2,
      "recommended_semester": [
        4
      ],
      "semester_credit_distribution": {
        "4": 2
      },
      "semester_allocation_note": null,
      "category": "通识教育课",
      "required_or_elective": "required",
      "selection_group": null,
      "selection_rule": null,
      "source_page": 20,
      "issue_ids": []
    },
    {
      "code": "12008000",
      "name": "习近平新时代中国特色社会主义思想概论",
      "credits": 3,
      "recommended_semester": [
        4
      ],
      "semester_credit_distribution": {
        "4": 3
      },
      "semester_allocation_note": null,
      "category": "通识教育课",
      "required_or_elective": "required",
      "selection_group": null,
      "selection_rule": null,
      "source_page": 20,
      "issue_ids": []
    },
    {
      "code": "11711800",
      "name": "中国近现代史纲要",
      "credits": 2,
      "recommended_semester": [
        2
      ],
      "semester_credit_distribution": {
        "2": 2
      },
      "semester_allocation_note": null,
      "category": "通识教育课",
      "required_or_elective": "required",
      "selection_group": null,
      "selection_rule": null,
      "source_page": 20,
      "issue_ids": []
    },
    {
      "code": "12007900",
      "name": "思想道德与法治",
      "credits": 3,
      "recommended_semester": [
        1
      ],
      "semester_credit_distribution": {
        "1": 3
      },
      "semester_allocation_note": null,
      "category": "通识教育课",
      "required_or_elective": "required",
      "selection_group": null,
      "selection_rule": null,
      "source_page": 20,
      "issue_ids": []
    },
    {
      "code": "12005300",
      "name": "形势与政策",
      "credits": 2,
      "recommended_semester": [
        1,
        2,
        3,
        4,
        5,
        6,
        7,
        8
      ],
      "semester_credit_distribution": null,
      "semester_allocation_note": "每学期平均分配；源表未给出每学期精确学分。",
      "category": "通识教育课",
      "required_or_elective": "required",
      "selection_group": null,
      "selection_rule": null,
      "source_page": 20,
      "issue_ids": []
    },
    {
      "code": "113076*0",
      "name": "体育",
      "credits": 4,
      "recommended_semester": [
        1,
        2,
        3,
        4
      ],
      "semester_credit_distribution": {
        "1": 1,
        "2": 1,
        "3": 1,
        "4": 1
      },
      "semester_allocation_note": null,
      "category": "通识教育课",
      "required_or_elective": "required",
      "selection_group": null,
      "selection_rule": null,
      "source_page": 20,
      "issue_ids": []
    },
    {
      "code": "109234*0",
      "name": "大学英语",
      "credits": 9,
      "recommended_semester": [
        1,
        2,
        3
      ],
      "semester_credit_distribution": {
        "1": 3,
        "2": 3,
        "3": 3
      },
      "semester_allocation_note": null,
      "category": "通识教育课",
      "required_or_elective": "required",
      "selection_group": null,
      "selection_rule": null,
      "source_page": 20,
      "issue_ids": []
    },
    {
      "code": "14300300",
      "name": "军事理论",
      "credits": 2,
      "recommended_semester": [
        1
      ],
      "semester_credit_distribution": {
        "1": 2
      },
      "semester_allocation_note": null,
      "category": "通识教育课",
      "required_or_elective": "required",
      "selection_group": null,
      "selection_rule": null,
      "source_page": 20,
      "issue_ids": []
    },
    {
      "code": "12008200",
      "name": "劳动教育（理论课）",
      "credits": 1,
      "recommended_semester": [
        1
      ],
      "semester_credit_distribution": {
        "1": 1
      },
      "semester_allocation_note": null,
      "category": "通识教育课",
      "required_or_elective": "required",
      "selection_group": null,
      "selection_rule": null,
      "source_page": 20,
      "issue_ids": []
    },
    {
      "code": null,
      "name": "通识教育选修课程组（含地球科学概论、生态学概论两门必修要求；美育、心理健康教育各不少于2学分；跨学科选修不低于4学分）",
      "credits": 12,
      "recommended_semester": null,
      "semester_credit_distribution": null,
      "semester_allocation_note": "根据所选课程开课学期分配。",
      "category": "通识教育课",
      "required_or_elective": "requirement_group",
      "selection_group": null,
      "selection_rule": null,
      "source_page": 20,
      "issue_ids": [
        "general-elective-components-not-enumerated"
      ]
    },
    {
      "code": "22300100",
      "name": "自动化与测控技术导论",
      "credits": 1,
      "recommended_semester": [
        1
      ],
      "semester_credit_distribution": {
        "1": 1
      },
      "semester_allocation_note": null,
      "category": "大类平台课",
      "required_or_elective": "required",
      "selection_group": null,
      "selection_rule": null,
      "source_page": 20,
      "issue_ids": []
    },
    {
      "code": "20732100",
      "name": "工程制图",
      "credits": 2,
      "recommended_semester": [
        1
      ],
      "semester_credit_distribution": {
        "1": 2
      },
      "semester_allocation_note": null,
      "category": "大类平台课",
      "required_or_elective": "required",
      "selection_group": null,
      "selection_rule": null,
      "source_page": 20,
      "issue_ids": []
    },
    {
      "code": "212127*1",
      "name": "高等数学A",
      "credits": 11.5,
      "recommended_semester": [
        1,
        2
      ],
      "semester_credit_distribution": {
        "1": 5,
        "2": 6.5
      },
      "semester_allocation_note": null,
      "category": "大类平台课",
      "required_or_elective": "required",
      "selection_group": null,
      "selection_rule": null,
      "source_page": 20,
      "issue_ids": []
    },
    {
      "code": "21945700",
      "name": "计算机程序设计基础",
      "credits": 2.5,
      "recommended_semester": [
        1
      ],
      "semester_credit_distribution": {
        "1": 2.5
      },
      "semester_allocation_note": null,
      "category": "大类平台课",
      "required_or_elective": "required",
      "selection_group": null,
      "selection_rule": null,
      "source_page": 21,
      "issue_ids": []
    },
    {
      "code": "212130*1",
      "name": "大学物理A",
      "credits": 8,
      "recommended_semester": [
        2,
        3
      ],
      "semester_credit_distribution": {
        "2": 4,
        "3": 4
      },
      "semester_allocation_note": null,
      "category": "大类平台课",
      "required_or_elective": "required",
      "selection_group": null,
      "selection_rule": null,
      "source_page": 21,
      "issue_ids": []
    },
    {
      "code": "212169*1",
      "name": "物理实验A",
      "credits": 2,
      "recommended_semester": [
        2,
        3
      ],
      "semester_credit_distribution": {
        "2": 1,
        "3": 1
      },
      "semester_allocation_note": null,
      "category": "大类平台课",
      "required_or_elective": "required",
      "selection_group": null,
      "selection_rule": null,
      "source_page": 21,
      "issue_ids": []
    },
    {
      "code": "21212802",
      "name": "线性代数B",
      "credits": 2.5,
      "recommended_semester": [
        3
      ],
      "semester_credit_distribution": {
        "3": 2.5
      },
      "semester_allocation_note": null,
      "category": "大类平台课",
      "required_or_elective": "required",
      "selection_group": null,
      "selection_rule": null,
      "source_page": 21,
      "issue_ids": []
    },
    {
      "code": "21213501",
      "name": "概率论与数理统计A",
      "credits": 3.5,
      "recommended_semester": [
        3
      ],
      "semester_credit_distribution": {
        "3": 3.5
      },
      "semester_allocation_note": null,
      "category": "大类平台课",
      "required_or_elective": "required",
      "selection_group": null,